comment,chat_luong,dong_goi,van_chuyen,gia_ca,overall
sản phẩm tốt ra mực đều,positive,neutral,neutral,neutral,positive
đóng gói cẩn thận giao hàng nhanh ship nhiệt tình,neutral,positive,positive,neutral,positive
bút viết trơn. giá quá rẻ. giao hàng chậm nhưng được đền,positive,neutral,negative,positive,positive
giao hàng nhanh đầy đủ. bút viết ra mực đều,positive,neutral,positive,neutral,positive
đủ số lượng. có nút nhựa bảo vệ. mực ra đều êm tay. giá tốt,positive,positive,neutral,positive,positive
giao hàng nhanh đóng gói cẩn thận. săn được giá rẻ,neutral,positive,positive,positive,positive
bút rẻ mà mực viết êm. mua nhiều về viết,positive,neutral,neutral,positive,positive
viết mượt mực đều đẹp. giá rẻ. mua tiếp,positive,neutral,neutral,positive,positive
bút dùng tốt giao đủ. nắp lỏng dễ mất. quên đóng nắp là vứt,neutral,neutral,neutral,neutral,neutral
bút viết đều tốt. sản phẩm chất lượng ok. giao hàng nhanh,positive,neutral,positive,neutral,positive
bút mực xanh vỏ nhám mờ. chất lượng tốt,positive,neutral,neutral,neutral,positive
rẻ mang đi học mất không tiếc. mực đều ngòi nhỏ nhưng ít mực viết nhanh hết,neutral,neutral,neutral,positive,neutral
tạm ổn đúng mô tả. tiền nào của đó,neutral,neutral,neutral,neutral,neutral
bút giá rẻ. mực êm phù hợp giá tiền. shipper nhiệt tình,positive,neutral,positive,positive,positive
bút dùng tốt không vấn đề gì,positive,neutral,neutral,neutral,positive
bút ra mực đều đúng đủ,positive,neutral,neutral,neutral,positive
bút viết tốt vì là bút gel nên mực hết nhanh khô chậm. giá ổn,neutral,neutral,neutral,positive,neutral
bút gel ra đều màu mực tốt. đóng mở nắp dễ dàng,positive,neutral,neutral,neutral,positive
nhận đúng đủ hàng đóng gói cẩn thận. giao hàng nhanh,neutral,positive,positive,neutral,positive
viết không chảy mực nhưng hay tắc mực,negative,neutral,neutral,neutral,negative
bút dùng ok áp mã giảm giá quá hời. siêu hài lòng,positive,neutral,neutral,positive,positive
giao hàng nhanh đầy đủ có tặng thêm. ngòi hơi bẩn,neutral,neutral,positive,neutral,neutral
chất lượng tốt nét đậm đúng với hình ảnh,positive,neutral,neutral,neutral,positive
đóng gói tốt giao hàng nhanh giá rẻ. viết tốt đúng quảng cáo,positive,positive,positive,positive,positive
giao hàng nhanh viết ra mực đều nhưng càng viết càng nhạt. dễ viết,neutral,neutral,positive,neutral,neutral
đóng gói giao hàng nhanh. bút viết thích mực nhanh khô không bị nhòe,positive,positive,positive,neutral,positive
bút rẻ chất lượng. khá nhẹ cầm không mỏi viết mượt,positive,neutral,neutral,positive,positive
mua lần 2 ok. bút xinh viết mượt,positive,neutral,neutral,neutral,positive
bút rẻ viết trơn. săn sale giá 0đ,positive,neutral,neutral,positive,positive
đẹp giá rẻ. giao hàng nhanh đúng mô tả,positive,neutral,positive,positive,positive
nhầm review sản phẩm đồng hồ,neutral,neutral,neutral,neutral,neutral
bút viết nhanh khô. sờ vội hơi lem mực,neutral,neutral,neutral,neutral,neutral
bút đẹp đều mực chất liệu tốt xịn,positive,neutral,neutral,neutral,positive
viết khá ổn nhanh hết mực. không bị in đậm sang trang sau,neutral,neutral,neutral,neutral,neutral
bút viết đẹp êm ra đều mực không bị nhòe hay lem,positive,neutral,neutral,neutral,positive
chất lượng tốt giống hình. dùng rất tốt,positive,neutral,neutral,neutral,positive
viết trơn đẹp. dùng rất tốt,positive,neutral,neutral,neutral,positive
đủ số lượng. bút viết êm mực ra đều. giá ok,positive,neutral,neutral,positive,positive
bút viết rất thích nét nhỏ mực đều. giao hàng nhanh đóng gói cẩn thận,positive,positive,positive,neutral,positive
bút viết hơi tắc nhưng giá rẻ nên ok,neutral,neutral,neutral,positive,neutral
xinh cute viết đẹp mực đều,positive,neutral,neutral,neutral,positive
viết ok nhưng mực nhòe. giá quá rẻ,neutral,neutral,neutral,positive,neutral
ban đầu viết êm về sau gai tắc mực bị chảy mực. chất lượng kém,negative,neutral,neutral,neutral,negative
đúng mô tả. màu sắc đẹp,positive,neutral,neutral,neutral,positive
màu đen. đúng mô tả. chất liệu vải túi hơi to,neutral,neutral,neutral,neutral,neutral
màu đen. vải túi mềm đẹp. hợp túi tiền,positive,neutral,neutral,positive,positive
ship giao hàng thân thiện chuyên nghiệp. đóng gói cẩn thận. chất lượng chờ xem,neutral,positive,positive,neutral,positive
túi dùng ok chống nước. màu xám nhìn đẹp,positive,neutral,neutral,neutral,positive
hàng đẹp nhưng mua mới có vết dơ,negative,neutral,neutral,neutral,negative
đúng mô tả. kiểu dáng đẹp. túi có hơi mùi,negative,neutral,neutral,neutral,neutral
vải khá mỏng chất lượng bình thường,neutral,neutral,neutral,neutral,neutral
túi đẹp. da công nghiệp hơi mỏng dây đeo hơi thô. phù hợp giá tiền,neutral,neutral,neutral,positive,positive
chất liệu tốt. hơi nhỏ so với miêu tả,neutral,neutral,neutral,neutral,neutral
túi nhìn ổn nhưng hơi bé,neutral,neutral,neutral,neutral,neutral
không phải vải canvas. đúng mô tả. túi ok nhưng chưa hài lòng lắm,neutral,neutral,neutral,neutral,neutral
bên ngoài không đẹp như video nhưng đáng đồng tiền,neutral,neutral,neutral,positive,positive
túi khá ok hợp túi tiền. dây không bền lắm,negative,neutral,neutral,positive,neutral
gần đúng mô tả. không vừa ipad,negative,neutral,neutral,neutral,negative
chất liệu dù. hàng đúng mô tả,positive,neutral,neutral,neutral,positive
hơi nhỏ,neutral,neutral,neutral,neutral,neutral
sản phẩm khá ok. rất phù hợp với giá tiền,positive,neutral,neutral,positive,positive
màu sắc ok đẹp,positive,neutral,neutral,neutral,positive
chất liệu ok tạm ổn,neutral,neutral,neutral,neutral,neutral
ở ngoài nhỏ quá,negative,neutral,neutral,neutral,negative
chất liệu ok nhưng hơi nhỏ,neutral,neutral,neutral,neutral,neutral
đường chỉ không được chắc chắn,negative,neutral,neutral,neutral,negative
phù hợp giá tiền chất dày dặn đường may chắc. móc khóa nhựa dễ gãy. lỗ luồn dây không có nút che,neutral,neutral,neutral,positive,neutral
túi đẹp đúng mô tả đường may cẩn thận nhiều ngăn chống nước. ổn so với giá,positive,neutral,neutral,positive,positive
chất vải dù chống nước túi đẹp. khóa nhựa cứng nhìn không chắc chắn,neutral,neutral,neutral,neutral,neutral
đóng gói kỹ đúng mô tả giao hàng nhanh. túi bị bẩn bụi,negative,positive,positive,neutral,neutral
túi cũng được. giao hàng nhanh,neutral,neutral,positive,neutral,positive
giao đúng mẫu. quai bấm hơi lỏng lẻo,negative,neutral,neutral,neutral,neutral
vải chống nước. khóa hơi rít cảm giác nhanh hỏng,neutral,neutral,neutral,neutral,neutral
tạm,neutral,neutral,neutral,neutral,neutral
ok,positive,neutral,neutral,neutral,positive
chất vải túi đẹp đúng hình,positive,neutral,neutral,neutral,positive
túi vải hơi mỏng,negative,neutral,neutral,neutral,negative
móc khóa bằng nhựa,neutral,neutral,neutral,neutral,neutral
cũng tàm tạm,neutral,neutral,neutral,neutral,neutral
ok chất vải,positive,neutral,neutral,neutral,positive
sản phẩm ok,positive,neutral,neutral,neutral,positive
shop gói hàng nhanh. giao đúng màu nhưng cái màu đen bị gãy 1 xương,negative,positive,positive,neutral,negative
dù mỏng không chắc chắn ra gió yếu dễ gãy. đi nắng ít gió thì ok,negative,neutral,neutral,neutral,neutral
mua nhầm loại dù yếu dễ lật. đặt màu đen giao màu xanh rất thất vọng,negative,neutral,neutral,neutral,negative
tạm được ộp ẹp tiền nào của đấy. gió thổi mạnh bay dù,negative,neutral,neutral,neutral,negative
ô bị vỡ,negative,neutral,neutral,neutral,negative
ô nhỏ chỉ phù hợp cho trẻ nhỏ. không có mô tả kích thước,negative,neutral,neutral,neutral,negative
giống trong ảnh. đóng gói kĩ. dù chắc chắn nhưng hơi mỏng dễ rách. giao hơi lâu,negative,positive,negative,neutral,negative
ô chắc chắn nhưng cột trụ lỏng. vành ô không cụp sâu đi mưa vẫn bị ướt,negative,neutral,neutral,neutral,negative
hàng không ổn. quảng cáo tự động nhưng giao thủ công. 8 nan yếu vải mỏng,negative,neutral,neutral,neutral,negative
dù tự động xài không êm. dùng lực tay nhiều hơn dù thủ công,negative,neutral,neutral,neutral,negative
ô quảng cáo có nút bấm mà không có,negative,neutral,neutral,neutral,negative
sản phẩm giống mô tả. ô tự động phù hợp giá tiền. ô thủ công giá cao,positive,neutral,neutral,neutral,positive
dù hơi nhỏ mỏng so với dự kiến. khó xài phải dùng lực lớn chốt khó khớp. giá tạm,negative,neutral,neutral,neutral,negative
xài được mở đóng không hư. giá khá chát cho dù nhỏ. có lỗi nhưng shop hỗ trợ,neutral,neutral,neutral,negative,neutral
dễ gỉ sét dù không dày. tay cầm hay bị rớt,negative,neutral,neutral,neutral,negative
giao hàng nhanh. ô bị gãy 1 xương vẫn dùng tạm được. giá rẻ. che nắng ổn mưa chịu không nổi,negative,neutral,positive,positive,negative
tự động mở ok nhưng đóng lúc đi mưa hắt ướt hết người. kéo cây cầm nặng,negative,neutral,neutral,neutral,negative
ghi 24 xương nhưng hóa ra loại 8 xương giá rẻ mà không ghi rõ,negative,neutral,neutral,negative,negative
dù bật nhanh tay cầm chắc nhưng 8 nan hơi yếu. vải dù ổn. shop giao hỏa tốc chậm phản hồi cứng nhắc,negative,neutral,negative,neutral,negative
giao hàng nhanh. ô che được một người cầm nhẹ tay nhỏ gọn nhưng tay cầm ngắn gây mỏi. giá khá ổn,neutral,neutral,positive,positive,neutral
dù nhỏ gọn vải khá mỏng lỏng lẻo. không ưng lắm,negative,neutral,neutral,neutral,negative
giá rẻ nên ọp ẹp nhanh hư,negative,neutral,neutral,positive,negative
gói hàng cẩn thận nguyên vẹn. ô khá mỏng chỉ che nắng nhẹ hoặc mưa nhỏ. mưa to dột từ cán xuống che như không che. được cái nhỏ gọn,negative,positive,neutral,neutral,negative
giao hàng nhanh. ô mỏng không chắc chắn ọp ẹp,negative,neutral,positive,neutral,negative
khung hơi yếu mở nhanh bị dảnh ngược ra sau,negative,neutral,neutral,neutral,negative
chất lượng tệ thủng vài chỗ. thanh yếu phí tiền mong manh dễ gãy,negative,neutral,neutral,negative,negative
dù gấp lại khó mùi hóa chất hôi nồng nặc,negative,neutral,neutral,neutral,negative
ô hơi bé che hai người bị ướt,negative,neutral,neutral,neutral,negative
dù mỏng kim loại mỏng dễ đứt. thiết kế tay cầm sai. tiền nào của đó,negative,neutral,neutral,neutral,negative
dù hỏng chốt bấm. trả hàng hoàn tiền khó khăn,negative,neutral,negative,neutral,negative
dù khá mỏng thân không cứng cáp gió to sợ gãy phù hợp giá tiền,negative,neutral,neutral,neutral,negative
vải dù mỏng vài nếp gấp làm lỗ nhỏ. shop giao hàng hơi lâu,negative,neutral,negative,neutral,negative
đóng lại khó sắt nhọn đứt tay. ô bình thường không to lắm,negative,neutral,neutral,neutral,negative
khung ô hơi yếu. đẹp so với giá,neutral,neutral,neutral,positive,neutral
đóng hàng sơ sài. ship lâu do mưa bão. ô bấm nút không gọn kéo lại cực cứng,negative,negative,negative,neutral,negative
dù mỏng không chắc chắn. mùi rất hôi,negative,neutral,neutral,neutral,negative
mũi khâu ẩu rúm ô không chắc chắn. giá 47k chất lượng chỉ đến thế,negative,neutral,neutral,neutral,negative
nan ô mỏng bằng sợi tóc. ô nhỏ chán,negative,neutral,neutral,neutral,negative
ô quá nhỏ không tốt như nghĩ,negative,neutral,neutral,neutral,negative
giao nhanh đóng gói cẩn thận. chất liệu bóng không đẹp giá rẻ,negative,positive,positive,positive,neutral
mưa có thể ướt ở trong trục trặc. giá rẻ,negative,neutral,neutral,positive,negative
giao nhanh đóng gói đẹp cẩn thận. dù rách ngay trên đầu,negative,positive,positive,neutral,negative
ô ngắn gọn để vừa balo nhưng bề mặt cán nhám ấn mở khó. chiều dài thân ngắn không hợp đi mưa. dùng 1 thời gian đứt dây hỏng nút,negative,neutral,neutral,neutral,negative
loại tự động ok loại thủ công yếu mùi hôi gió bay luôn. tiền nào của đó,negative,neutral,neutral,neutral,negative
màu hồng sến không giống ảnh,negative,neutral,neutral,neutral,negative
chất lượng khá tệ nhăn xấu độ hoàn thiện kém bị xước. che mưa nắng ok thẩm mỹ kém do vận chuyển hoặc đóng gói,negative,negative,negative,neutral,negative
chất vải hơi mỏng mở ra mở vào cứng khó,negative,neutral,neutral,neutral,negative
bấm ra ok nhưng gập ô rất chật. gặp gió dễ lật ngửa,negative,neutral,neutral,neutral,negative
dây cài dù không chắc dễ bung dù hơi yếu có gió bật ngược. hợp lí với giá,negative,neutral,neutral,positive,neutral
đặt màu đen giao màu xanh,negative,neutral,neutral,neutral,negative
sản phẩm giao đúng nhưng dù bấm phải dùng lực mạnh,neutral,neutral,neutral,neutral,neutral
tay cầm lỏng chất lượng kém. giao sai loại mở thủ công thay vì tự động,negative,neutral,neutral,neutral,negative
ô nhỏ xíu vừa cho bé che nắng đi mưa thì ướt,negative,neutral,neutral,neutral,negative
dù yếu muốn rớt cán. không hài lòng,negative,neutral,neutral,neutral,negative
shop mall giao thiếu đồ,negative,neutral,neutral,neutral,negative
ô bé nhưng chắc chắn thu vào nặng tay khó ấn,neutral,neutral,neutral,neutral,neutral
chất liệu rởm đi mưa hư liền dễ hư chỉ hợp che nắng. giá 80k đáng mua,negative,neutral,neutral,positive,neutral
vải dù hơi mỏng nhìn chung ổn,neutral,neutral,neutral,neutral,neutral
vải dù mỏng dễ rách dễ hư,negative,neutral,neutral,neutral,negative
hàng đẹp nút bấm bung tốt nhưng không gấp gọn được,negative,neutral,neutral,neutral,negative
rất yếu mỏng đóng lại không vô nếp đút không vô vỏ. hơi thất vọng,negative,neutral,neutral,neutral,negative
dù dễ han gỉ đi mưa mấy ngày là gỉ,negative,neutral,neutral,neutral,negative
dù gấp dễ hư bung chỗ chật bị gãy. dùng 1 tháng không đóng tự động được nữa,negative,neutral,neutral,neutral,negative
mới mở lần đầu đã gãy lòi sợi thủy tinh,negative,neutral,neutral,neutral,negative
đóng gói kĩ càng sản phẩm tốt,positive,positive,neutral,neutral,positive
dù mỏng dây treo rớt khi thu dù may ít chỉ,negative,neutral,neutral,neutral,negative
ô ọp ẹp mỏng nhưng giá rẻ,negative,neutral,neutral,positive,neutral
giao nhanh ô hơi nhỏ phù hợp giá tiền,neutral,neutral,positive,positive,neutral
chất lượng không tốt ô không chắc chắn. shipper thân thiện,negative,neutral,positive,neutral,negative
khung yếu vải mỏng chỉ hợp mưa nhỏ dễ lật. giá rẻ xài tạm. giao hơi lâu,negative,neutral,negative,positive,negative
bung dù ra tay cầm rớt luôn,negative,neutral,neutral,neutral,negative
hơi khó gấp chỉ may lỗi bung ra,negative,neutral,neutral,neutral,negative
cây dù nhỏ xíu thân ngắn dùng vài hôm rách,negative,neutral,neutral,neutral,negative
tiền nào của nấy bung tùm lum,negative,neutral,neutral,neutral,negative
khó sử dụng nút cứng,negative,neutral,neutral,neutral,negative
cụp lại muốn gãy tay,negative,neutral,neutral,neutral,negative
chất lượng mỏng dễ gãy,negative,neutral,neutral,neutral,negative
dù mở ra gãy luôn,negative,neutral,neutral,neutral,negative
bung gấp 1 nút ổn nhưng thu ngắn cực cứng nặng tay,negative,neutral,neutral,neutral,negative
thủ công không kĩ xương dù dễ ngược,negative,neutral,neutral,neutral,negative
hơi nhỏ hơn dự tính,negative,neutral,neutral,neutral,negative
xương dù mỏng nhỏ gió mạnh bật ngược gãy liền,negative,neutral,neutral,neutral,negative
dù mỏng khó gập lại. dùng 2-3 lần kẹt không kéo xuống được,negative,neutral,neutral,neutral,negative
bình luận rác không liên quan,neutral,neutral,neutral,neutral,neutral
mở ra quá bé quảng cáo không đúng,negative,neutral,neutral,neutral,negative
nút nhấn cứng. màu không giống hình,negative,neutral,neutral,neutral,negative
dù bé yếu chỉ dùng che mưa nhỏ không bền,negative,neutral,neutral,neutral,negative
shop không nhiệt tình. ô bị gãy,negative,neutral,neutral,neutral,negative
cầm không chắc chắn dây cuốn sắp bung,negative,neutral,neutral,neutral,negative
giao hàng nhanh. nút bấm cứng. dù mỏng yếu. giá rẻ tạm chấp nhận,negative,neutral,positive,positive,neutral
màu sắc đẹp nhưng chất lượng đáng ngại. chỗ để nước gãy ngay lần đầu dùng. nhân viên nhiệt tình đổi hàng. vali tương đối nhẹ,negative,neutral,neutral,neutral,negative
chất liệu nhựa không đáng tiền 800k,negative,neutral,neutral,negative,negative
nhận hàng thất vọng nhìn như đồ đã xài rồi,negative,neutral,neutral,neutral,negative
màu sắc đẹp nhưng trên vali nhiều chỗ dơ và bị quẹt xước,negative,neutral,neutral,neutral,negative
vali xước nhiều góc. giao hàng lâu. tay cầm rít khóa rít. chất lượng kém so với chỗ khác,negative,neutral,negative,neutral,negative
mua cái thứ 2 nhận hàng thấy móp rồi,negative,neutral,neutral,neutral,negative
giao hàng nhanh nhưng bị trầy xước rất nhiều. cần xem lại cách đóng gói,negative,negative,positive,neutral,negative
giao sai bản nhầm hàng mỏng so với giá. xem đánh giá nhiều người bị giống. giá chênh quá chán,negative,neutral,neutral,negative,negative
vali kéo mượt hơi ồn màu xám xi măng. bị móp ngăn không có móc. trải nghiệm buồn,negative,neutral,neutral,neutral,negative
giao nhanh bọc chống sốc cẩn thận đúng mô tả. nhiều vết bẩn nhỏ lau không sạch mất mỹ quan,neutral,positive,positive,neutral,neutral
vali đẹp cứng cáp khá nặng bánh xe mượt nhựa giòn không dày. ship nhanh đóng gói kĩ. màu bên ngoài khác xa trên hình rất thất vọng,negative,positive,positive,neutral,negative
vali bẩn khóa trầy xước rỉ sét. đóng gói không ổn không có nilon bọc ngoài,negative,negative,neutral,neutral,negative
màu đẹp nhưng trải nghiệm không tốt. bên này xử lí kém,negative,neutral,neutral,neutral,negative
hình thức đẹp nhưng full nhựa chỉ bọc góc nhôm. sử dụng có vẻ không bền,neutral,neutral,neutral,neutral,neutral
đổi hàng do xước gỉ bẩn nhưng vẫn không hài lòng chất lượng,negative,neutral,neutral,neutral,negative
nhựa mỏng vải nilon bên trong cho có khóa nhanh hỏng thanh kéo kẹt. chất lượng tệ,negative,neutral,neutral,neutral,negative
đúng mô tả giống cũng ok nhưng có mấy chỗ bị chầy,neutral,neutral,neutral,neutral,neutral
bo 4 góc méo xước trên vali nhiều vết bẩn. nhận hàng thất vọng,negative,neutral,neutral,neutral,negative
đóng gói cẩn thận mà trầy quá nhiều ngứa mắt. chưa xài chưa biết bền không,negative,positive,neutral,neutral,negative
khui vali mới thì khóa bị hư không xoay được. mong nhãn hàng hỗ trợ,negative,neutral,neutral,neutral,negative
hàng ok nhưng góc bo cạnh xấu và kéo khóa bên trong không chất lượng. sài vài lần sẽ hư,negative,neutral,neutral,neutral,negative
đúng mô tả. trầy nhiều chỗ khóa nhìn như hỏng vá lại. đóng gói ok,negative,positive,neutral,neutral,negative
tay cầm lỏng lẻo lỗi 4-5 chỗ trên vali. không tên thương hiệu dập. đóng bọc mỗi hộp hãng,negative,negative,neutral,neutral,negative
vali không chắc chắn nhìn mong manh. sẽ không mua lại,negative,neutral,neutral,neutral,negative
ship nhanh 2 ngày nhận. vali hơi mỏng tay cầm chắc chắn màu sắc ưng,neutral,neutral,positive,neutral,positive
lưới may bên trong tệ tiết kiệm lớp lót sớm muộn cũng hỏng. khóa sập nhựa dùng xách tay chứ ký gửi quăng mạnh chắc gãy. giao hàng nhanh nhưng hỏi đổi trả không trả lời,negative,neutral,positive,neutral,negative
ship nhanh. vali nhẹ nhưng bị trầy xước móp méo tất cả các cạnh. nên cải thiện chống sốc,negative,negative,positive,neutral,negative
đặt màu bạc hộp ghi bạc nhưng giao màu trắng,negative,neutral,neutral,neutral,negative
mới mở hộp đã móp 1 cạnh. kiểu dáng cơ bản quảng cáo nói quá,negative,neutral,neutral,neutral,negative
đẹp tay cầm lỏng lẻo bị móp bị trầy. so với giá sale cũng ok,negative,neutral,neutral,positive,neutral
giao hàng nhanh. có nhiều vết rỉ sét ở kim loại vết xước,negative,neutral,positive,neutral,negative
giao hàng thất vọng. tay xách giảm chấn không như lần trước ổ khóa không khít hở nhiều,negative,neutral,neutral,neutral,negative
chất lượng ok shop ok nhưng đóng gói kém thùng móp hàng trầy nhẹ. shop nhiệt tình đền bù,positive,negative,neutral,neutral,positive
đặt hỏa tốc 2 ngày mới nhận. vali trầy xước nhiều,negative,neutral,negative,neutral,negative
sản phẩm đẹp mùi nhựa nồng trầy xước bên ngoài bên trong nút trắng bị vênh,negative,neutral,neutral,neutral,negative
săn giá rẻ nhưng sản phẩm lỗi buồn,negative,neutral,neutral,positive,negative
giao sai màu đổi lại móp 1 góc nhôm không muốn đổi nữa. chăm sóc khách hàng nhiệt tình chất lượng đi xa khá ổn. vali chuyến trước gãy bánh xe,neutral,neutral,neutral,neutral,neutral
vali đẹp nhẹ gọn bị móp 3 chỗ,negative,neutral,neutral,neutral,negative
giao hàng nhanh chăm sóc nhiệt tình nhưng đổi 2 khóa vali vẫn thấy rủ,negative,neutral,positive,neutral,negative
nhựa cứng mỏng nhẹ. khóa sập nhựa móc treo nhựa không chắc chắn. giá hơi cao,negative,neutral,neutral,negative,negative
giá cao mà vali nhiều bụi bám khóa han gỉ cũ kĩ. hơi thất vọng về sản phẩm,negative,neutral,neutral,negative,negative
chất liệu không chắc chắn đựng ít đồ tay cầm xước sơn bóc. trót mua không xem nhận xét,negative,neutral,neutral,neutral,negative
bất mãn mua deal sốc giá đắt hơn bình thường hình túi to giao túi bé,neutral,neutral,neutral,negative,negative
chăm sóc khách hàng ok đóng gói chưa tốt,neutral,negative,neutral,neutral,neutral
mới khui đã trầy chất liệu ọp ẹp không chắc chắn không dùng lâu dài được,negative,neutral,neutral,neutral,negative
cạnh móp méo lồi lõm bánh xe bẩn như đã sử dụng,negative,neutral,neutral,neutral,negative
giao hàng nhanh đóng gói cực ẩu không bọc xốp chống va đập,neutral,negative,positive,neutral,neutral
vali lỗi rách bên trong chỗ đựng đồ còn lại ổn,negative,neutral,neutral,neutral,neutral
móp góc không chìa khóa khóa nhựa không bền,negative,neutral,neutral,neutral,negative
vali nhiều lỗi bánh xe cao su móp nứt đường may bung chốt nhựa lỏng ổ khóa kẹt,negative,neutral,neutral,neutral,negative
vali gọn bắt mắt khung gập không ổn lỏng lẻo xách lên dễ bung,negative,neutral,neutral,neutral,negative
vali lỗi giao hàng chậm do tết. shop nhiệt tình hỗ trợ,negative,neutral,negative,neutral,neutral
vali xước góc bo viền bung. không hài lòng trải nghiệm,negative,neutral,neutral,neutral,negative
hàng xài tạm giao hàng cũ khóa bên ăn bên không,negative,neutral,neutral,neutral,negative
vali đẹp chắc chắn. thất vọng vì tay cầm ố màu nên trao đổi trước khi mua,negative,neutral,neutral,neutral,negative
giao hàng nhanh đóng gói cẩn thận. vali dởm tay kéo rít khóa lỏng lẻo,negative,positive,positive,neutral,negative
dùng đúng 1 lần móp trầy hết sơn dù bọc nilon. cầm không chắc tay khóa sập không chắc như quảng cáo,negative,neutral,neutral,neutral,negative
bình luận nhầm sản phẩm váy đầm. chất đẹp đóng gói cẩn thận,neutral,positive,neutral,neutral,neutral
giao hàng tới móp méo size nhỏ trước mua thì ok,negative,neutral,neutral,neutral,negative
tấm lót trong bằng nhựa mỏng manh cảm giác không bền,negative,neutral,neutral,neutral,negative
